{"$schema":"https://json-schema.org/draft/2020-12/schema","$id":"https://github.com/Pagebabe/comic/project/schemas/program-evidence-v2.schema.json","title":"Comic Factory Program Evidence V2","type":"object","additionalProperties":false,"required":["schema_version","repository","generated_at","source_main","program_status","decision","integration","control_proofs","truth","blocked_gates","release_rules","activation_controls","main_merge_allowed","live_activation_allowed","integrity"],"properties":{"schema_version":{"const":2},"repository":{"const":"Pagebabe/comic"},"generated_at":{"type":"string","format":"date-time"},"source_main":{"type":"object","additionalProperties":false,"required":["branch","head_sha","unchanged"],"properties":{"branch":{"const":"main"},"head_sha":{"$ref":"#/$defs/sha40"},"unchanged":{"const":true}}},"program_status":{"const":"PROGRAM_INTEGRATION_PROVEN_PENDING_LOCAL_ASSET_SCAN"},"decision":{"const":"PROGRAM_EVIDENCE_CURRENT"},"integration":{"$ref":"#/$defs/integration"},"control_proofs":{"type":"object","additionalProperties":false,"required":["final_rehearsal","evidence_v1"],"properties":{"final_rehearsal":{"type":"object","additionalProperties":false,"required":["pull_request","head_sha","merge_test_sha","run_id","artifact_id","digest","manifest_sha256"],"properties":{"pull_request":{"const":148},"head_sha":{"$ref":"#/$defs/sha40"},"merge_test_sha":{"$ref":"#/$defs/sha40"},"run_id":{"type":"integer","minimum":1},"artifact_id":{"type":"integer","minimum":1},"digest":{"$ref":"#/$defs/digest"},"manifest_sha256":{"$ref":"#/$defs/hash64"}}},"evidence_v1":{"type":"object","additionalProperties":false,"required":["pull_request","head_sha","status"],"properties":{"pull_request":{"const":141},"head_sha":{"$ref":"#/$defs/sha40"},"status":{"const":"HISTORICAL_SUPERSEDED_BY_V2"}}}}},"truth":{"type":"object","additionalProperties":false,"required":["local_asset_scan","source_assets_modified","automatic_master_approvals","character_masters","location_masters","voice_masters","real_pilot_proven","production_ready","beginner_ready"],"properties":{"local_asset_scan":{"const":"NOT_EXECUTED"},"source_assets_modified":{"const":false},"automatic_master_approvals":{"const":0},"character_masters":{"const":"0/4"},"location_masters":{"const":"0/4"},"voice_masters":{"const":"0/3"},"real_pilot_proven":{"const":false},"production_ready":{"const":false},"beginner_ready":{"const":false}}},"blocked_gates":{"type":"array","minItems":5,"maxItems":5,"uniqueItems":true,"items":{"enum":["MAIN_MERGE_DECISION_REQUIRED","LOCAL_ASSET_SCAN_NOT_EXECUTED","REAL_MASTERS_NOT_APPROVED","REAL_PILOT_NOT_PROVEN","LIVE_ACTIVATION_FORBIDDEN"]}},"release_rules":{"type":"object","additionalProperties":false,"required":["fail_closed","current_integration_head_required","exact_product_tree_required","all_workflows_green_required","local_asset_scan_required","human_master_approval_required","real_pilot_required","human_main_merge_approval_required"],"properties":{"fail_closed":{"const":true},"current_integration_head_required":{"const":true},"exact_product_tree_required":{"const":true},"all_workflows_green_required":{"const":true},"local_asset_scan_required":{"const":true},"human_master_approval_required":{"const":true},"real_pilot_required":{"const":true},"human_main_merge_approval_required":{"const":true}}},"activation_controls":{"type":"object","additionalProperties":false,"required":["oauth_allowed","platform_accounts_connected","network_execution_allowed","publishing_allowed"],"properties":{"oauth_allowed":{"const":false},"platform_accounts_connected":{"const":0},"network_execution_allowed":{"const":false},"publishing_allowed":{"const":false}}},"main_merge_allowed":{"const":false},"live_activation_allowed":{"const":false},"integrity":{"type":"object","additionalProperties":false,"required":["algorithm","manifest_sha256"],"properties":{"algorithm":{"const":"sha256"},"manifest_sha256":{"$ref":"#/$defs/hash64"}}}},"$defs":{"sha40":{"type":"string","pattern":"^[a-f0-9]{40}$"},"hash64":{"type":"string","pattern":"^[a-f0-9]{64}$"},"digest":{"type":"string","pattern":"^sha256:[a-f0-9]{64}$"},"run":{"type":"object","additionalProperties":false,"required":["workflow","run_id","artifact_id","digest"],"properties":{"workflow":{"type":"string","minLength":1},"run_id":{"type":"integer","minimum":1},"artifact_id":{"type":"integer","minimum":1},"digest":{"$ref":"#/$defs/digest"}}},"integration":{"type":"object","additionalProperties":false,"required":["branch","head_sha","product_tree_sha","package_sha256","status","pull_request","source_heads","proofs","runs","main_merge_allowed","live_activation_allowed"],"properties":{"branch":{"const":"integration/canon-episode-growth"},"head_sha":{"$ref":"#/$defs/sha40"},"product_tree_sha":{"$ref":"#/$defs/sha40"},"package_sha256":{"$ref":"#/$defs/hash64"},"status":{"const":"ACTUAL_INTEGRATION_BRANCH_PROVEN"},"pull_request":{"type":"object","additionalProperties":false,"required":["number","state","draft","merged","base_branch","base_sha","merge_test_sha"],"properties":{"number":{"const":150},"state":{"const":"open"},"draft":{"const":true},"merged":{"const":false},"base_branch":{"const":"main"},"base_sha":{"$ref":"#/$defs/sha40"},"merge_test_sha":{"$ref":"#/$defs/sha40"}}},"source_heads":{"type":"object","additionalProperties":false,"required":["canon_cast","episode_pipeline","growth_shadow"],"properties":{"canon_cast":{"$ref":"#/$defs/sha40"},"episode_pipeline":{"$ref":"#/$defs/sha40"},"growth_shadow":{"$ref":"#/$defs/sha40"}}},"proofs":{"type":"object","additionalProperties":false,"required":["product_tree_matches_rehearsal","package_hash_matches_rehearsal","bootstrap_absent","expected_conflict_only","full_regression_green","browser_proof_green","fresh_install_green","operator_recovery_green","growth_handoff_green","growth_shadow_green","episode_pipeline_green"],"properties":{"product_tree_matches_rehearsal":{"const":true},"package_hash_matches_rehearsal":{"const":true},"bootstrap_absent":{"const":true},"expected_conflict_only":{"const":"package.json"},"full_regression_green":{"const":true},"browser_proof_green":{"const":true},"fresh_install_green":{"const":true},"operator_recovery_green":{"const":true},"growth_handoff_green":{"const":true},"growth_shadow_green":{"const":true},"episode_pipeline_green":{"const":true}}},"runs":{"type":"array","minItems":6,"maxItems":6,"items":{"$ref":"#/$defs/run"}},"main_merge_allowed":{"const":false},"live_activation_allowed":{"const":false}}}}}
