{"schema_version":2,"repository":"Pagebabe/comic","generated_at":"2026-07-12T11:45:00Z","source_main":{"branch":"main","head_sha":"b58534d0a737b1d01834628177e1090de027de61","unchanged":true},"program_status":"PROGRAM_INTEGRATION_PROVEN_PENDING_LOCAL_ASSET_SCAN","decision":"PROGRAM_EVIDENCE_CURRENT","integration":{"branch":"integration/canon-episode-growth","head_sha":"9bf5c5350138371c4940475cf36fb51ba7d4ae9e","product_tree_sha":"5adae6d73f85d7ffb72bd285cd2184ae498038ce","package_sha256":"d04b323ad69b12c1428df89dad2b35a397ac530196a18c07db5f0d118a4c9b34","status":"ACTUAL_INTEGRATION_BRANCH_PROVEN","pull_request":{"number":150,"state":"open","draft":true,"merged":false,"base_branch":"main","base_sha":"b58534d0a737b1d01834628177e1090de027de61","merge_test_sha":"a66e43a76640c65937501b74686e34fbcd64292f"},"source_heads":{"canon_cast":"1bb4df874d8e2a36fd32fbad19074ed629ec922d","episode_pipeline":"e8b8e348120ad527abe7a33caab9f56b6627f8c2","growth_shadow":"77f77db12a227c976e6e33ef7afde655f455772e"},"proofs":{"product_tree_matches_rehearsal":true,"package_hash_matches_rehearsal":true,"bootstrap_absent":true,"expected_conflict_only":"package.json","full_regression_green":true,"browser_proof_green":true,"fresh_install_green":true,"operator_recovery_green":true,"growth_handoff_green":true,"growth_shadow_green":true,"episode_pipeline_green":true},"runs":[{"workflow":"Comic Factory CI","run_id":29191223093,"artifact_id":8259584188,"digest":"sha256:3c7974f06f695d35211429308bce02f630f4da30830e9fac76ff6a2475e51df3"},{"workflow":"Fresh Install Drill","run_id":29191223092,"artifact_id":8259577319,"digest":"sha256:2bd803c7748e9d168523e1fcd430caf0c27379c302093b63b5da322937e71262"},{"workflow":"Operator Recovery Drill","run_id":29191223062,"artifact_id":8259570398,"digest":"sha256:4bbfe1e00497be330c3858f3293160c605df10e4ce8bfe6d5540a4040be13641"},{"workflow":"Growth Factory Handoff","run_id":29191223129,"artifact_id":8259570443,"digest":"sha256:0652e0b2a1079ed91aae0caf3ba9583e9deee1a41e3a3b2d9a7ad07a76f38925"},{"workflow":"Studio MKT0 Shadow Integration","run_id":29191223119,"artifact_id":8259570932,"digest":"sha256:65466ab0a4de8ff7df5b9b0e0ca2fefff9d504e7502299d0b5ad8956a33cf39f"},{"workflow":"Worker 2 Episode 1 Production Proof","run_id":29191223088,"artifact_id":8259577115,"digest":"sha256:acd9739edfc97e027880a4a040651b66a8be3a9f212d07e710bc0a4af4cfdb67"}],"main_merge_allowed":false,"live_activation_allowed":false},"control_proofs":{"final_rehearsal":{"pull_request":148,"head_sha":"ed4e18e086b579e9f35c6f2269bec8a774121014","merge_test_sha":"8aaae1cde362a3605969e06da973ec812d74c911","run_id":29190877463,"artifact_id":8259488839,"digest":"sha256:7d20a45779f2f1f4babb9cd074256d1ca868a8f105446bf7cc757eadecfe2e81","manifest_sha256":"642d6990fba1b32f475bbda9539bf84e5a137d1e47b763d48c1839568ace04d7"},"evidence_v1":{"pull_request":141,"head_sha":"d1a25610c37e076c6df87f585d9439265d536861","status":"HISTORICAL_SUPERSEDED_BY_V2"}},"truth":{"local_asset_scan":"NOT_EXECUTED","source_assets_modified":false,"automatic_master_approvals":0,"character_masters":"0/4","location_masters":"0/4","voice_masters":"0/3","real_pilot_proven":false,"production_ready":false,"beginner_ready":false},"blocked_gates":["MAIN_MERGE_DECISION_REQUIRED","LOCAL_ASSET_SCAN_NOT_EXECUTED","REAL_MASTERS_NOT_APPROVED","REAL_PILOT_NOT_PROVEN","LIVE_ACTIVATION_FORBIDDEN"],"release_rules":{"fail_closed":true,"current_integration_head_required":true,"exact_product_tree_required":true,"all_workflows_green_required":true,"local_asset_scan_required":true,"human_master_approval_required":true,"real_pilot_required":true,"human_main_merge_approval_required":true},"activation_controls":{"oauth_allowed":false,"platform_accounts_connected":0,"network_execution_allowed":false,"publishing_allowed":false},"main_merge_allowed":false,"live_activation_allowed":false,"integrity":{"algorithm":"sha256","manifest_sha256":"b7368e7614893b1fe55336ff397258f59bb3d1affd58f6d4526cea9f56bf7c9c"}}
